{"$schema":"https://json-schema.org/draft/2020-12/schema","$id":"cognitive-proof-eval-receipt-intake-v4","title":"Local receipt intake bound to PR #41 sampling wire","type":"object","required":["schema_version","kind","source_commit","dataset","slot_registration","trusted_proof_digest_registry","sampling_wire_prompt_digest_registry","run","records"],"properties":{"schema_version":{"const":"cognitive-proof-eval-receipt-intake-v4"},"kind":{"enum":["synthetic_non_result","candidate_live_receipt"]},"source_commit":{"type":"string","pattern":"^[0-9a-f]{40}$"},"dataset":{"type":"object","required":["path","sha256"]},"slot_registration":{"type":"object","required":["path","sha256"]},"trusted_proof_digest_registry":{"type":"object","required":["path","sha256"]},"sampling_wire_prompt_digest_registry":{"type":"object","required":["path","sha256"]},"run":{"type":"object","required":["model","adapter","base_prompt_sha256","wrapper_prompt_sha256","input_mode","sampling","retry_policy"],"properties":{"sampling":{"type":"object","required":["temperature","top_p"],"properties":{"temperature":{"type":"number","minimum":0,"maximum":2},"top_p":{"type":"number","minimum":0,"maximum":1}},"additionalProperties":false}}},"records":{"type":"array","minItems":1}},"additionalProperties":false}
