{"schema_version":"cognitive-proof-eval-receipt-intake-v4","kind":"synthetic_non_result","source_commit":"97df020eeffd83df9eaaec4608056046a8ff6198","dataset":{"path":"dataset.json","sha256":"63d68d4decad2dcdadbfc1204c58cec2650a46a90442cb63889e3d7989e07e51"},"slot_registration":{"path":"slot-registration-v1.json","sha256":"4d05d2176f4e629370771925543d4670259e15b633c5ef3be47803c6c9bf9a46"},"trusted_proof_digest_registry":{"path":"trusted-proof-digest-registry-v1.json","sha256":"a68d6a010b7225f42bedb447a209e50617cd26bf2a9a6ab40aa0d40b61ae42e4"},"sampling_wire_prompt_digest_registry":{"path":"sampling-wire-assembled-prompt-digest-registry-v4.json","sha256":"fcab9aa10a390690e1b74cd33e63d06d1dfd99195d90b9d4142ee4a9c812be7d"},"run":{"model":"SYNTHETIC-NOT-A-MODEL","adapter":"SYNTHETIC-NO-PROVIDER","base_prompt_sha256":"8df2ced7953c5f9f3e58ad6e416356c7674f7c2774d3281735bf674e71907c38","wrapper_prompt_sha256":"140bedbf9c3f6d56a9846d2ba7088798683f4da0c248231336e6a05679e4fdfe","input_mode":"sealed-assembled-prompt-byte-for-byte","sampling":{"temperature":0,"top_p":1},"retry_policy":{"max_attempts":1,"retryable":[]}},"records":[{"record_id":"synthetic-multi-hop-01-p0","case_id":"multi_hop_01","condition":"P0","run_binding_sha256":"429a85cd1868d32af318edf6b6eac461c06987e37da5bc5f3b5e1571b2c01b3f","snapshot_sha256":"0e259842d60734021b47e7c6ce573c4d49edda7eb6d1ae5baf53479e5f4a40ad","query_sha256":"7741f940050512bee53a082d5b068f8ae647972bfac706aaecb58603262301e3","slot_bytes":1024,"trusted_proof_sha256":null,"prompt_sha256":"ff1c97eaa9f048e0ef094d6303271c632d8122ab6b8dce1f6efeb38990934a50","prompt":{"ref":"local://synthetic/non-result-p0.prompt","sha256":"1111111111111111111111111111111111111111111111111111111111111111"},"raw":{"ref":"local://synthetic/non-result-p0.raw","sha256":"86aa29da869d6ce9f1139b35069f797355a5ef32ffa83970f812e24ccf9d328f"},"usage":{"measured_effective_context_budget":1024,"provider_usage":{"input_tokens":0,"output_tokens":0}},"scorer":{"decision":"synthetic_non_result","contract_sha256":"cccccccccccccccccccccccccccccccccccccccccccccccccccccccccccccccc"},"supersedes_record_id":null},{"record_id":"synthetic-multi-hop-01-p1","case_id":"multi_hop_01","condition":"P1","run_binding_sha256":"429a85cd1868d32af318edf6b6eac461c06987e37da5bc5f3b5e1571b2c01b3f","snapshot_sha256":"0e259842d60734021b47e7c6ce573c4d49edda7eb6d1ae5baf53479e5f4a40ad","query_sha256":"7741f940050512bee53a082d5b068f8ae647972bfac706aaecb58603262301e3","slot_bytes":1024,"trusted_proof_sha256":"0a26e195ea04bf06089285b93ec25e9173682cb3fb5e31acd46ad7a1207ce133","prompt_sha256":"65a367a03370468e85e83ad9bb63549fa5da077045e3c24f888321415fc0261d","prompt":{"ref":"local://synthetic/non-result-p1.prompt","sha256":"2222222222222222222222222222222222222222222222222222222222222222"},"raw":{"ref":"local://synthetic/non-result-p1.raw","sha256":"9dbcaa96f468321a348a13f005400f09a56eec62ff18d3c0e6214cb803351ea4"},"usage":{"measured_effective_context_budget":1024,"provider_usage":{"input_tokens":0,"output_tokens":0}},"scorer":{"decision":"synthetic_non_result","contract_sha256":"cccccccccccccccccccccccccccccccccccccccccccccccccccccccccccccccc"},"supersedes_record_id":null}]}
